nl_cmd,bash_cmd
can you update expressvpn for me,sudo apt-get upgrade expressvpn
please check for and install any updates for expressvpn,sudo apt-get upgrade expressvpn
update expressvpn to the latest version,sudo apt-get upgrade expressvpn


remove android studio from my system,sudo snap remove android-studio
i want to uninstall android studio,sudo snap remove android-studio
how do i delete android studio,sudo snap remove android-studio
uninstall anydesk from my computer,sudo snap remove anydesk
uninstall anydesk for me please,sudo snap remove anydesk
remove anydesk from my ubuntu installation,sudo snap remove anydesk
what's the command to uninstall php storm,sudo snap remove phpstorm
i want to remove php storm can you guide me through it,sudo snap remove phpstorm
remove php storm from my system,sudo snap remove phpstorm
uninstall eclipse for me please,sudo snap remove eclipse
i want to uninstall eclipse,sudo snap remove eclipse
how do i delete eclipse,sudo snap remove eclipse
uninstall pycharm professional from my computer,sudo snap remove pycharm-professional
uninstall pycharm professional for me please,sudo snap remove pycharm-professional
remove pycharm professional from my ubuntu installation,sudo snap remove pycharm-professional
what's the command to uninstall intellij idea,sudo snap remove intellij-idea-ultimate
remove intellij idea from my system,sudo snap remove intellij-idea-ultimate
i want to uninstall intellij idea,sudo snap remove intellij-idea-ultimate
uninstall pycharm for me please,sudo snap remove pycharm-community
i want to uninstall pycharm,sudo snap remove pycharm-community
how do i delete pycharm,sudo snap remove pycharm-community
what's the command to uninstall vs code,sudo snap remove code
can you help me remove vs code,sudo snap remove code
uninstall vs code for me please,sudo snap remove code
remove notepad++ from my system,sudo snap remove notepad-plus-plus
i want to uninstall notepad plus plus,sudo snap remove notepad-plus-plus
can you help me remove notepad++,sudo snap remove notepad-plus-plus
uninstall sublime text for me please,sudo snap remove sublime-text
how do i delete sublime text,sudo snap remove sublime-text
uninstall sublime text from my computer,sudo snap remove sublime-text
remove postman from my ubuntu installation,sudo snap remove postman
what's the command to uninstall postman,sudo snap remove postman
remove postman from my system,sudo snap remove postman
uninstall kubectl for me,sudo snap remove kubectl
i don't need kubectl anymore delete it,sudo snap remove kubectl
how can i get rid of kubectl,sudo snap remove kubectl
uninstall the powershell package,sudo snap remove powershell
help me remove powershell,sudo snap remove powershell
i need powershell removed can you do that,sudo snap remove powershell
delete intellij idea ultimate from this machine,sudo snap remove intellij-idea-ultimate
uninstall intellij idea ultimate from my system,sudo snap remove intellij-idea-ultimate
remove intellij idea ultimate for me,sudo snap remove intellij-idea-ultimate
help me remove webstorm,sudo snap remove webstorm
uninstall the webstorm package,sudo snap remove webstorm
i don't want webstorm anymore delete it,sudo snap remove webstorm
uninstall the go package,sudo snap remove go
i need go removed can you do that,sudo snap remove go
delete go from this machine,sudo snap remove go
remove nodejs from my system,sudo snap remove node
uninstall nodejs for me,sudo snap remove node
i don't need nodejs anymore delete it,sudo snap remove node
remove nodejs from my system,sudo snap remove node
uninstall nodejs for me,sudo snap remove node
i don't need nodejs anymore delete it,sudo snap remove node
i need apache ant removed can you do that,sudo snap remove ant-jm
delete apache ant from this machine,sudo snap remove ant-jm
remove apache ant for me,sudo snap remove ant-jm
i don't want apache netbeans anymore delete it,sudo snap remove netbeans
how can i uninstall apache netbeans,sudo snap remove netbeans
uninstall apache netbeans from my system,sudo snap remove netbeans
uninstall the kotlin package,sudo snap remove kotlin
help me remove kotlin,sudo snap remove kotlin
i need kotlin removed can you do that,sudo snap remove kotlin
delete ruby from my system,sudo snap remove ruby
uninstall ruby for me,sudo snap remove ruby
i don't need ruby anymore delete it,sudo snap remove ruby
how can i uninstall flutter,sudo snap remove flutter
uninstall flutter from my system,sudo snap remove flutter
help me remove flutter,sudo snap remove flutter
uninstall the goland package,sudo snap remove goland
i need goland removed can you do that,sudo snap remove goland
delete goland from this machine,sudo snap remove goland
uninstall flutter gallery from my system,sudo snap remove flutter-gallery
remove flutter gallery for me,sudo snap remove flutter-gallery
i need flutter gallery removed can you do that,sudo snap remove flutter-gallery
how can i get rid of nginx,sudo snap remove nginx
take nginx off my computer,sudo snap remove nginx
remove the nginx package,sudo snap remove nginx
delete prometheus from this machine,sudo snap remove prometheus
help me remove prometheus,sudo snap remove prometheus
uninstall prometheus from my system,sudo snap remove prometheus
remove slack for me,sudo snap remove slack
i don't want slack anymore delete it,sudo snap remove slack
how can i uninstall slack,sudo snap remove slack
uninstall the gradle package,sudo snap remove gradle
i need gradle removed can you do that,sudo snap remove gradle
delete gradle from this machine,sudo snap remove gradle
help me remove jenkins,sudo snap remove jenkins
uninstall jenkins from my system,sudo snap remove jenkins
remove jenkins for me,sudo snap remove jenkins
i don't need telegram anymore delete it,sudo snap remove telegram-desktop
remove the telegram package,sudo snap remove telegram-desktop
uninstall telegram from this machine,sudo snap remove telegram-desktop
delete skype from this machine,sudo snap remove skype
help me remove skype,sudo snap remove skype
i need skype removed can you do that,sudo snap remove skype
uninstall zulip from my system,sudo snap remove zulip
remove zulip for me,sudo snap remove zulip
i don't want zulip anymore delete it,sudo snap remove zulip
how can i uninstall discord,sudo snap remove discord
uninstall the discord package,sudo snap remove discord
i need discord removed can you do that,sudo snap remove discord
delete signal desktop from this machine,sudo snap remove signal-desktop
help me remove signal,sudo snap remove signal-desktop
uninstall signal desktop from my system,sudo snap remove signal-desktop
remove zenchat completely,sudo snap remove zenchat 
i don't need zenchat anymore please remove it,sudo snap remove zenchat 
how do i uninstall zenchat,sudo snap remove zenchat 
delete thunder from my computer,sudo snap remove thunder 
can you help me remove thunder,sudo snap remove thunder 
uninstall thunder and remove all its files,sudo snap remove thunder 
completely remove whatsapp from my machine,sudo snap remove whatsapp-for-linux 
uninstall whatsapp for linux from my system,sudo snap remove whatsapp-for-linux 
remove whatsapp completely,sudo snap remove whatsapp-for-linux 
i don't need zoom anymore please remove it,sudo snap remove zoom-client 
how do i uninstall zoom,sudo snap remove zoom-client 
delete zoom from my computer,sudo snap remove zoom-client 
can you help me remove brave,sudo snap remove brave
uninstall brave and remove all its files,sudo snap remove brave
completely remove brave from my machine,sudo snap remove brave
uninstall firefox from my system,sudo snap remove firefox 
remove firefox completely,sudo snap remove firefox 
i don't need firefox anymore please remove it,sudo snap remove firefox 
how do i uninstall opera,sudo snap remove opera 
delete opera from my computer,sudo snap remove opera 
can you help me remove opera,sudo snap remove opera 
uninstall scrcpy and remove all its files,sudo snap remove scrcpy 
completely remove scrcpy from my machine,sudo snap remove scrcpy
uninstall scrcpy from my system,sudo snap remove scrcpy 
remove spotify completely,sudo snap remove spotify 
i don't need spotify anymore please remove it,sudo snap remove spotify 
how do i uninstall spotify,sudo snap remove spotify 
how do i uninstall gitkraken,sudo snap remove gitkraken 
remove all gitkraken components from my system,sudo snap remove gitkraken 
uninstall gitkraken and clean up related files,sudo snap remove gitkraken 
completely remove postman from my machine,sudo snap remove postman 
remove postman from my system,sudo snap remove postman 
uninstall postman completely,sudo snap remove postman 
i want to delete microsoft teams,sudo snap remove teams-for-linux 
help me remove microsoft teams from my computer,sudo snap remove teams-for-linux 
how do i uninstall microsoft teams,sudo snap remove teams-for-linux 
remove all netbeans components from my system,sudo snap remove netbeans 
uninstall netbeans and clean up related files,sudo snap remove netbeans 
completely remove netbeans from my machine,sudo snap remove netbeans  
remove kubernetes from my system,sudo snap remove microk8s 
uninstall kubernetes completely,sudo snap remove microk8s 
i want to delete kubernetes,sudo snap remove microk8s 
how do i uninstall mysql,sudo snap remove mysql
delete mysql from my computer,sudo snap remove mysql
can you help me remove mysql,sudo snap remove mysql

uninstall chrome and remove all its files,sudo apt remove google-chrome-stable 
completely remove chrome from my machine,sudo apt remove google-chrome-stable
uninstall chrome from my system,sudo apt remove google-chrome-stable 
remove libreoffice completely,sudo apt remove libreoffice* 
i don't need libreoffice anymore please remove it,sudo apt remove libreoffice* 
how do i uninstall libreoffice,sudo apt remove libreoffice* 
delete mongodb from my computer,sudo apt remove mongodb 
can you help me remove mongodb,sudo apt remove mongodb 
uninstall mongodb and remove all its files,sudo apt remove mongodb 
completely remove python from my machine,sudo apt remove python3 
uninstall python from my system,sudo apt remove python3 
remove python completely,sudo apt remove python3 
i don't need java anymore please remove it,sudo apt remove default-jdk 
how do i uninstall java,sudo apt remove default-jdk 
delete java from my computer,sudo apt remove default-jdk 
can you help me remove sqlite,sudo apt remove sqlite3 
uninstall sqlite and remove all its files,sudo apt remove sqlite3 
completely remove sqlite from my machine,sudo apt remove sqlite3 
uninstall c compiler from my system,sudo apt remove build-essential 
remove c compiler completely,sudo apt remove build-essential 
i don't need c compiler anymore please remove it,sudo apt remove build-essential 
uninstall vim from my computer,sudo apt remove vim
uninstall vim for me please,sudo apt remove vim
remove vim from my ubuntu installation,sudo apt remove vim
what's the command to uninstall ansible,sudo apt remove ansible
i want to remove ansible can you guide me through it,sudo apt remove ansible
remove ansible from my system,sudo apt remove ansible

uninstall gimp completely,sudo apt-get remove gimp
i want to delete gimp,sudo apt-get remove gimp
help me remove gimp from my computer,sudo apt-get remove gimp
how do i uninstall obs studio,sudo apt-get remove obs-studio
remove all obs studio components from my system,sudo apt-get remove obs-studio
uninstall obs studio and clean up related files,sudo apt-get remove obs-studio
completely remove kdenlive from my machine,sudo apt-get remove kdenlive
remove kdenlive from my system,sudo apt-get remove kdenlive
uninstall kdenlive completely,sudo apt-get remove kdenlive
i want to delete virtualbox,sudo apt-get remove virtualbox
help me remove virtualbox from my computer,sudo apt-get remove virtualbox
how do i uninstall virtualbox,sudo apt-get remove virtualbox
remove all wireshark components from my system,sudo apt-get remove wireshark
uninstall wireshark and clean up related files,sudo apt-get remove wireshark
completely remove wireshark from my machine,sudo apt-get remove wireshark
uninstall windscribe for me please,sudo apt-get remove windscribe-cli
remove windscribe from my ubuntu installation,sudo apt-get remove windscribe-cli
what's the command to uninstall windscribe,sudo apt-get remove windscribe-cli
uninstall protonvpn from my computer,sudo apt-get remove protonvpn-cli
uninstall protonvpn for me please,sudo apt-get remove protonvpn-cli
remove protonvpn from my ubuntu installation,sudo apt-get remove protonvpn-cli
remove expressvpn from my ubuntu installation,sudo apt-get remove expressvpn
what's the command to uninstall expressvpn,sudo apt-get remove expressvpn
remove expressvpn from my system,sudo apt-get remove expressvpn
