nl_cmd,bash_cmd
can you install android studio for me,sudo snap install android-studio 
download the android studio application,sudo snap install android-studio 
please add android studio to my ubuntu,sudo snap install android-studio 
i want to install anydesk app,sudo snap install anydesk
get anydesk software into my system,sudo snap install anydesk
fetch the anydesk application in my system,sudo snap install anydesk
what's the command to install php storm,sudo snap install phpstorm 
download the php storm application,sudo snap install phpstorm 
can you install php storm for me,sudo snap install phpstorm 
i want to install eclipse app,sudo snap install eclipse 
can you install eclipse for me,sudo snap install eclipse 
please add eclipse to my ubuntu,sudo snap install eclipse 
please add pycharm professional to my ubuntu,sudo snap install pycharm-professional 
how do i set up pycharm professional on my system,sudo snap install pycharm-professional 
i need pycharm professional on my computer,sudo snap install pycharm-professional 
could you help me get intellij idea running,sudo snap install intellij-idea-ultimate 
download the intellij idea application,sudo snap install intellij-idea-ultimate 
can you install intellij idea for me,sudo snap install intellij-idea-ultimate 
please add pycharm to my ubuntu,sudo snap install pycharm-community 
i want to install pycharm app,sudo snap install pycharm-community 
get pycharm software into my system,sudo snap install pycharm-community 
how do i set up vs code on my system,sudo snap install code 
i need vs code on my computer,sudo snap install code 
what's the command to install vs code,sudo snap install code 
download the notepad++ application,sudo snap install notepad-plus-plus
i want to install notepad plus plus app,sudo snap install notepad-plus-plus
can you install notepad + + for me,sudo snap install notepad-plus-plus
i want to install sublime text app,sudo snap install sublime-text
get sublime text software into my system,sudo snap install sublime-text
how do i set up sublime text on my system,sudo snap install sublime-text
what's the command to install postman,sudo snap install postman
could you help me get postman running,sudo snap install postman
download the postman application,sudo snap install postman
i want to install kubectl app,sudo snap install kubectl 
get kubectl software into my system,sudo snap install kubectl 
can you install kubectl for me,sudo snap install kubectl 
please add powershell to my machine,sudo snap install powershell 
download and install powershell,sudo snap install powershell 
i want to use powershell install it please,sudo snap install powershell 
i want to use intellij idea ultimate install it please,sudo snap install intellij-idea-ultimate 
install intellij idea ultimate on my system,sudo snap install intellij-idea-ultimate 
set up intellij idea ultimate for me,sudo snap install intellij-idea-ultimate 
please add webstorm to my machine,sudo snap install webstorm 
i want to use webstorm install it please,sudo snap install webstorm 
i need webstorm can you install it,sudo snap install webstorm 
download and install go,sudo snap install go 
i want to use go install it please,sudo snap install go 
help me set up go,sudo snap install go 
install nodejs on my system,sudo snap install node 
can you help me set up nodejs,sudo snap install node 
i need nodejs how do i get it,sudo snap install node 
download and install rubymine,sudo snap install rubymine 
please add rubymine to my machine,sudo snap install rubymine 
how do i get rubymine on my system,sudo snap install rubymine 
download and install apache ant,sudo snap install ant-jm
help me set up apache ant,sudo snap install ant-jm
install apache ant on my system,sudo snap install ant-jm
set up apache netbeans for me,sudo snap install netbeans 
i need apache netbeans can you install it,sudo snap install netbeans 
how do i get apache netbeans,sudo snap install netbeans 
i need kotlin can you install it,sudo snap install kotlin 
how do i get kotlin,sudo snap install kotlin 
download and install kotlin,sudo snap install kotlin 
download and install ruby please,sudo snap install ruby
install ruby on my system,sudo snap install ruby 
can you help me set up ruby,sudo snap install ruby 
please add flutter to my machine,sudo snap install flutter 
i want to use flutter install it please,sudo snap install flutter 
i need flutter can you install it,sudo snap install flutter 
please add goland to my machine,sudo snap install goland 
i want to use goland install it please,sudo snap install goland 
help me set up goland,sudo snap install goland 
install flutter gallery on my system,sudo snap install flutter-gallery
set up flutter gallery for me,sudo snap install flutter-gallery
take goland off my computer,sudo snap remove goland
please install nginx for me,sudo snap install nginx
get nginx running on my machine,sudo snap install nginx
set up nginx on this computer,sudo snap install nginx
get prometheus running on this computer,sudo snap install prometheus
i want to use prometheus install it please,sudo snap install prometheus
install prometheus on my computer,sudo snap install prometheus
i need slack can you install it,sudo snap install slack 
how do i get slack,sudo snap install slack 
please add slack to my computer,sudo snap install slack 
download and install gradle,sudo snap install gradle 
i want to use gradle install it please,sudo snap install gradle 
put gradle on my system,sudo snap install gradle 
help me set up jenkins,sudo snap install jenkins 
install jenkins on my system,sudo snap install jenkins 
i need jenkins can you install it,sudo snap install jenkins 
i need telegram how do i get it,sudo snap install telegram-desktop
please install telegram for me,sudo snap install telegram-desktop
get telegram desktop running on my machine,sudo snap install telegram-desktop
please add skype to my machine,sudo snap install skype 
download and install skype,sudo snap install skype 
get skype running on this computer,sudo snap install skype 
install zulip on my system,sudo snap install zulip
set up zulip for me,sudo snap install zulip
i need zulip can you install it,sudo snap install zulip
how do i get discord on my system,sudo snap install discord
please add discord to my machine,sudo snap install discord
download and install discord,sudo snap install discord
i want to use signal install it please,sudo snap install signal-desktop
help me set up signal desktop,sudo snap install signal-desktop
install signal on my system,sudo snap install signal-desktop
can you help me get zenchat,sudo snap install zenchat 
i need zenchat on my computer,sudo snap install zenchat 
download and install zenchat,sudo snap install zenchat 
how can i install thunder,sudo snap install thunder 
please add thunder to my machine,sudo snap install thunder 
i want to use thunder can you install it,sudo snap install thunder 
install the latest version of whatsapp,sudo snap install whatsapp-for-linux 
install whatsapp for linux on my system,sudo snap install whatsapp-for-linux 
can you help me get whatsapp,sudo snap install whatsapp-for-linux 
i need zoom on my computer,sudo snap install zoom-client 
download and install zoom,sudo snap install zoom-client 
how do i install zoom,sudo snap install zoom-client 
please add brave to my system,sudo snap install brave 
i want to use brave can you install it,sudo snap install brave 
install the latest version of brave,sudo snap install brave 
install firefox on my system,sudo snap install firefox
can you help me get firefox,sudo snap install firefox
i need firefox on my computer,sudo snap install firefox
download and install opera,sudo snap install opera 
how do i install opera,sudo snap install opera 
please add opera to my system,sudo snap install opera 
i want to use scrcpy can you install it,sudo snap install scrcpy 
install the latest version of scrcpy,sudo snap install scrcpy 
install scrcpy on my system,sudo snap install scrcpy 
can you help me get spotify,sudo snap install spotify 
i need spotify on my computer,sudo snap install spotify 
download and install spotify,sudo snap install spotify 
how do i get gitkraken running on my machine,sudo snap install gitkraken  
i want to start using gitkraken can you install it,sudo snap install gitkraken  
install the latest version of gitkraken,sudo snap install gitkraken  
download and install postman for me,sudo snap install postman 
install postman on my system,sudo snap install postman 
can you set up postman for me,sudo snap install postman 
i need microsoft teams installed on my computer,sudo snap install teams-for-linux 
please add microsoft teams to my ubuntu,sudo snap install teams-for-linux 
how do i get microsoft teams running on my machine,sudo snap install teams-for-linux 
i want to start using netbeans can you install it,sudo snap install netbeans  
install the latest version of netbeans,sudo snap install netbeans  
download and install netbeans for me,sudo snap install netbeans  
install kubernetes on my system,sudo snap install microk8s  
can you set up kubernetes for me,sudo snap install microk8s  
i need kubernetes installed on my computer,sudo snap install microk8s  
download and install mysql,sudo snap install mysql 
how do i install mysql,sudo snap install mysql 
please add mysql to my system,sudo snap install mysql

i want to use google chrome can you install it,sudo apt install google-chrome-stable 
install the latest version of chrome,sudo apt install google-chrome-stable 
install google chrome on my system,sudo apt install google-chrome-stable 
can you help me get libreoffice,sudo apt install libreoffice 
i need libreoffice on my computer,sudo apt install libreoffice 
download and install libreoffice,sudo apt install libreoffice 
how do i install mongodb,sudo apt install mongodb 
please add mongodb to my system,sudo apt install mongodb 
i want to use mongodb can you install it,sudo apt install mongodb 
install the latest version of python,sudo apt install python3 
install python on my system,sudo apt install python3 
can you help me get python,sudo apt install python3 
please add java to my system,sudo apt install default-jdk 
i want to use java can you install it,sudo apt install default-jdk 
install the latest version of java,sudo apt install default-jdk 
install sqlite on my system,sudo apt install sqlite3 
can you help me get sqlite,sudo apt install sqlite3 
i need sqlite on my computer,sudo apt install sqlite3 
download and install c compiler,sudo apt install build-essential 
how do i install c compiler,sudo apt install build-essential 
please add c compiler to my system,sudo apt install build-essential 
i need vim on my computer,sudo apt install vim
what's the command to install vim,sudo apt install vim
can you install vim for me,sudo apt install vim
download the ansible application,sudo apt install ansible
please add ansible to my ubuntu,sudo apt install ansible
i want to install ansible app,sudo apt install ansible

how do i get gimp running on my machine,sudo apt-get install gimp 
i want to start using gimp can you install it,sudo apt-get install gimp 
install the latest version of gimp,sudo apt-get install gimp 
download and install obs studio for me,sudo apt-get install obs-studio 
install obs studio on my system,sudo apt-get install obs-studio 
can you set up obs studio for me,sudo apt-get install obs-studio 
i need kdenlive installed on my computer,sudo apt-get install kdenlive 
please add kdenlive to my ubuntu,sudo apt-get install kdenlive 
how do i get kdenlive running on my machine,sudo apt-get install kdenlive 
i want to start using kdenlive can you install it,sudo apt-get install kdenlive 
install the latest version of kdenlive,sudo apt-get install kdenlive 
download and install kdenlive for me,sudo apt-get install kdenlive 
how do i get virtualbox running on my machine,sudo apt-get install virtualbox
install virtualbox on my system,sudo apt-get install virtualbox 
can you set up virtualbox for me,sudo apt-get install virtualbox 
i need wireshark installed on my computer,sudo apt-get install wireshark 
please add wireshark to my ubuntu,sudo apt-get install wireshark 
how do i get wireshark running on my machine,sudo apt-get install wireshark 
i want to use windscribe how do i install it,sudo apt-get install windscribe-cli
install the windscribe application for me,sudo apt-get install windscribe-cli
install windscribe vpn on my system,sudo apt-get install windscribe-cli
can you help me set up protonvpn,sudo apt-get install protonvpn-cli
i need protonvpn how do i get it,sudo apt-get install protonvpn-cli
download and install protonvpn for me,sudo apt-get install protonvpn-cli
what's the command to install expressvpn,sudo apt-get install expressvpn
please add expressvpn to my ubuntu system,sudo apt-get install expressvpn
i want to use expressvpn how do i install it,sudo apt-get install expressvpn


update android studio to the latest version,sudo snap refresh android-studio
i need to upgrade android studio can you help,sudo snap refresh android-studio
how do i update android studio,sudo snap refresh android-studio
is there a new version of anydesk please update it,sudo snap refresh anydesk
upgrade anydesk to the newest release,sudo snap refresh anydesk
update anydesk to the most recent version,sudo snap refresh anydesk
can you update php storm for me,sudo snap refresh phpstorm
please check for and install any updates for php storm,sudo snap refresh phpstorm
update php storm to the latest version,sudo snap refresh phpstorm
i need to upgrade eclipse can you help,sudo snap refresh eclipse
how do i update eclipse,sudo snap refresh eclipse
is there a new version of eclipse please update it,sudo snap refresh eclipse
upgrade pycharm professional to the newest release,sudo snap refresh pycharm-professional
update pycharm professional to the most recent version,sudo snap refresh pycharm-professional
i want the latest pycharm professional how do i update,sudo snap refresh pycharm-professional
please check for and install any updates for intellij idea,sudo snap refresh intellij-idea-ultimate
update intellij idea to the latest version,sudo snap refresh intellij-idea-ultimate
i need to upgrade intellij idea can you help,sudo snap refresh intellij-idea-ultimate
how do i update pycharm,sudo snap refresh pycharm-community
can you update pycharm for me,sudo snap refresh pycharm-community
upgrade pycharm to the newest release,sudo snap refresh pycharm-community
update vs code to the most recent version,sudo snap refresh code
i want the latest vs code how do i update,sudo snap refresh code
please check for and install any updates for vs code,sudo snap refresh code
update notepad++ to the latest version,sudo snap refresh notepad-plus-plus
i need to upgrade notepadplus plus can you help,sudo snap refresh notepad-plus-plus
how do i update notepad++,sudo snap refresh notepad-plus-plus
can you update sublime text for me,sudo snap refresh sublime-text
is there a new version of sublime text please update it,sudo snap refresh sublime-text
upgrade sublime text to the newest release,sudo snap refresh sublime-text
i want the latest postman how do i update,sudo snap refresh postman
please check for and install any updates for postman,sudo snap refresh postman
update postman to the latest version,sudo snap refresh postman
i need the newest kubectl update it please,sudo snap refresh kubectl
how do i get the latest kubectl version,sudo snap refresh kubectl
can you upgrade kubectl for me,sudo snap refresh kubectl
can you upgrade powershell for me,sudo snap refresh powershell
i need the latest powershell update it,sudo snap refresh powershell
refresh powershell on my system,sudo snap refresh powershell
check for intellij idea ultimate updates,sudo snap refresh intellij-idea-ultimate
update intellij idea ultimate to the latest version,sudo snap refresh intellij-idea-ultimate
get the newest intellij idea ultimate update,sudo snap refresh intellij-idea-ultimate
how do i update webstorm,sudo snap refresh webstorm
upgrade my webstorm app,sudo snap refresh webstorm
can you upgrade webstorm for me,sudo snap refresh webstorm
i need the latest go update it,sudo snap refresh go
update go to the newest release,sudo snap refresh go
check for go updates,sudo snap refresh go
update nodejs to the latest version,sudo snap refresh node
i need the newest nodejs update it please,sudo snap refresh node
how do i get the latest nodejs version,sudo snap refresh node
can you upgrade rubymine for me,sudo snap refresh rubymine
how do i update rubymine,sudo snap refresh rubymine
i need the latest rubymine update it,sudo snap refresh rubymine
update apache ant to the newest release,sudo snap refresh ant-jm
check for apache ant updates,sudo snap refresh ant-jm
update apache ant to the latest version,sudo snap refresh ant-jm
get the newest apache netbeans update,sudo snap refresh netbeans
upgrade my apache netbeans installation,sudo snap refresh netbeans
can you upgrade apache netbeans for me,sudo snap refresh netbeans
can you upgrade kotlin for me,sudo snap refresh kotlin
i need the latest kotlin update it,sudo snap refresh kotlin
update kotlin to the newest release,sudo snap refresh kotlin
check for and apply ruby updates,sudo snap refresh ruby
update ruby to the latest version,sudo snap refresh ruby
i need the newest ruby update it please,sudo snap refresh ruby
how do i update flutter,sudo snap refresh flutter
upgrade my flutter installation,sudo snap refresh flutter
can you upgrade flutter for me,sudo snap refresh flutter
i need the latest goland update it,sudo snap refresh goland
update goland to the newest release,sudo snap refresh goland
can you upgrade goland for me,sudo snap refresh goland
update flutter gallery to the latest version,sudo snap refresh flutter-gallery
upgrade my flutter gallery installation,sudo snap refresh flutter-gallery
get the newest flutter gallery update,sudo snap refresh flutter-gallery
how do i get the latest nginx version,sudo snap refresh nginx
get the most recent nginx update,sudo snap refresh nginx
upgrade nginx to the current release,sudo snap refresh nginx
can you upgrade prometheus for me,sudo snap refresh prometheus
check for prometheus updates,sudo snap refresh prometheus
update prometheus to the latest version,sudo snap refresh prometheus
upgrade my slack installation,sudo snap refresh slack
get the newest slack update,sudo snap refresh slack
how do i update slack,sudo snap refresh slack
i need the latest gradle update it,sudo snap refresh gradle
update gradle to the newest release,sudo snap refresh gradle
can you upgrade gradle for me,sudo snap refresh gradle
check for jenkins updates,sudo snap refresh jenkins
update jenkins to the latest version,sudo snap refresh jenkins
upgrade my jenkins installation,sudo snap refresh jenkins
i need the newest telegram update it please,sudo snap refresh telegram-desktop
how do i get the latest telegram version,sudo snap refresh telegram-desktop
get the most recent telegram update,sudo snap refresh telegram-desktop
update skype to the newest release,sudo snap refresh skype
can you upgrade skype for me,sudo snap refresh skype
check for skype updates,sudo snap refresh skype
update zulip to the latest version,sudo snap refresh zulip
upgrade my zulip installation,sudo snap refresh zulip
get the newest zulip update,sudo snap refresh zulip
how do i update discord,sudo snap refresh discord
i need the latest discord update it,sudo snap refresh discord
update discord to the newest release,sudo snap refresh discord
can you upgrade signal for me,sudo snap refresh signal-desktop
check for signal updates,sudo snap refresh signal-desktop
update signal desktop to the latest version,sudo snap refresh signal-desktop
upgrade my zenchat installation,sudo snap refresh zenchat 
is there a new version of zenchat available,sudo snap refresh zenchat 
check for zenchat updates,sudo snap refresh zenchat 
i want the latest features in thunder,sudo snap refresh thunder 
update thunder if a new version is available,sudo snap refresh thunder 
bring thunder to its latest version,sudo snap refresh thunder 
can you update whatsapp for me,sudo snap refresh whatsapp-for-linux 
update whatsapp for linux to the newest version,sudo snap refresh whatsapp-for-linux 
upgrade my whatsapp installation,sudo snap refresh whatsapp-for-linux 
is there a new version of zoom available,sudo snap refresh zoom-client 
make sure zoom is up to date,sudo snap refresh zoom-client 
check for zoom updates,sudo snap refresh zoom-client 
i want the latest features in brave,sudo snap refresh brave
update brave if possible,sudo snap refresh brave
can you update brave for me,sudo snap refresh brave
update firefox to the newest version,sudo snap refresh firefox 
upgrade my firefox installation,sudo snap refresh firefox 
is there a new version of firefox available,sudo snap refresh firefox 
make sure opera is up to date,sudo snap refresh opera 
check for opera updates,sudo snap refresh opera 
i want the latest features in opera,sudo snap refresh opera 
update scrcpy if possible,sudo snap refresh scrcpy 
can you update scrcpy for me,sudo snap refresh scrcpy 
update scrcpy to the newest version,sudo snap refresh scrcpy 
upgrade my spotify installation,sudo snap refresh spotify 
is there a new version of spotify available,sudo snap refresh spotify 
make sure spotify is up to date,sudo snap refresh spotify 
can you update gitkraken for me,sudo snap refresh gitkraken 
make sure i have the latest gitkraken release,sudo snap refresh gitkraken 
update all gitkraken components,sudo snap refresh gitkraken 
upgrade postman to its latest stable release,sudo snap refresh postman 
update postman to the latest version,sudo snap refresh postman 
upgrade my postman installation,sudo snap refresh postman 
check for microsoft teams updates and install them,sudo snap refresh teams-for-linux 
i need the newest version of microsoft teams,sudo snap refresh teams-for-linux 
can you update microsoft teams for me,sudo snap refresh teams-for-linux 
make sure i have the latest netbeans release,sudo snap refresh netbeans 
update all netbeans components,sudo snap refresh netbeans 
upgrade netbeans to its latest stable release,sudo snap refresh netbeans 
update kubernetes to the latest version,sudo snap refresh microk8s 
upgrade my kubernetes installation,sudo snap refresh microk8s 
check for kubernetes updates and install them,sudo snap refresh microk8s 
make sure mysql is up to date,sudo snap refresh mysql 
check for mysql updates,sudo snap refresh mysql 
i want the latest features in mysql,sudo snap refresh mysql 

update chrome if possible,sudo apt upgrade google-chrome-stable 
can you update chrome for me,sudo apt upgrade google-chrome-stable 
update chrome to the newest version,sudo apt upgrade google-chrome-stable 
upgrade my libreoffice installation,sudo apt upgrade libreoffice 
is there a new version of libreoffice available,sudo apt upgrade libreoffice 
make sure libreoffice is up to date,sudo apt upgrade libreoffice 
check for mongodb updates,sudo apt upgrade mongodb 
i want the latest features in mongodb,sudo apt upgrade mongodb 
update mongodb if possible,sudo apt upgrade mongodb 
can you update python for me,sudo apt upgrade python3 
update python to the newest version,sudo apt upgrade python3 
upgrade my python installation,sudo apt upgrade python3 
is there a new version of java available,sudo apt upgrade default-jdk 
make sure java is up to date,sudo apt upgrade default-jdk 
check for java updates,sudo apt upgrade default-jdk 
i want the latest features in sqlite,sudo apt upgrade sqlite3 
update sqlite if possible,sudo apt upgrade sqlite3 
can you update sqlite for me,sudo apt upgrade sqlite3 
update c compiler to the newest version,sudo apt upgrade build-essential 
upgrade my c compiler installation,sudo apt upgrade build-essential 
is there a new version of c compiler available,sudo apt upgrade build-essential 
is there a new version of vim please update it,sudo apt upgrade vim
upgrade vim to the newest release,sudo apt upgrade vim
update vim to the most recent version,sudo apt upgrade vim
please check for and install any updates for ansible,sudo apt upgrade ansible
can you update ansible for me,sudo apt upgrade ansible
update ansible to the latest version,sudo apt upgrade ansible

upgrade my gimp installation,sudo apt-get upgrade gimp 
check for gimp updates and install them,sudo apt-get upgrade gimp 
i need the newest version of gimp,sudo apt-get upgrade gimp 
how do i get obs studio running on my machine,sudo apt-get install obs-studio 
i want to start using obs studio can you install it,sudo apt-get install obs-studio 
install the latest version of obs studio,sudo apt-get install obs-studio 
upgrade kdenlive to its latest stable release,sudo apt-get upgrade kdenlive 
update kdenlive to the latest version,sudo apt-get upgrade kdenlive 
upgrade my kdenlive installation,sudo apt-get upgrade kdenlive 
check for virtualbox updates and install them,sudo apt-get upgrade virtualbox 
i need the newest version of virtualbox,sudo apt-get upgrade virtualbox 
can you update virtualbox for me,sudo apt-get upgrade virtualbox 
make sure i have the latest wireshark release,sudo apt-get upgrade wireshark 
update all wireshark components,sudo apt-get upgrade wireshark 
upgrade wireshark to its latest stable release,sudo apt-get upgrade wireshark 
update windscribe to the latest version,sudo apt-get upgrade windscribe-cli
i need to upgrade windscribe can you help,sudo apt-get upgrade windscribe-cli
how do i update windscribe vpn,sudo apt-get upgrade windscribe-cli
is there a new version of protonvpn please update it,sudo apt-get upgrade protonvpn-cli
upgrade protonvpn to the newest release,sudo apt-get upgrade protonvpn-cli
update protonvpn to the most recent version,sudo apt-get upgrade protonvpn-cli
